{
  "$schema": "https://json-schema.org/draft/2020-12/schema",
  "$id": "https://github.com/graydonpleasants/geo-polygonize/benchmarks/production-baseline-suite-v1.schema.json",
  "title": "geo-polygonize production baseline suite V1",
  "type": "object",
  "additionalProperties": false,
  "required": ["schema_version", "suite_id", "policy_id", "description", "required_publications"],
  "properties": {
    "schema_version": {"const": 1},
    "suite_id": {"const": "production-baseline-suite-v1"},
    "policy_id": {"const": "benchmark-decision-v1"},
    "description": {"type": "string", "minLength": 1},
    "required_publications": {
      "type": "array",
      "minItems": 1,
      "items": {"$ref": "#/$defs/publication"}
    }
  },
  "$defs": {
    "publication": {
      "type": "object",
      "additionalProperties": false,
      "required": [
        "entry_id",
        "workload_id",
        "lane",
        "coverage",
        "minimum_input_segments",
        "required_work_fields"
      ],
      "properties": {
        "entry_id": {
          "type": "string",
          "pattern": "^[a-z0-9][a-z0-9-]*$"
        },
        "workload_id": {
          "type": "string",
          "pattern": "^[a-z0-9][a-z0-9._-]*$"
        },
        "lane": {
          "enum": [
            "already-noded-polygonization",
            "floating-noding-plus-polygonization",
            "certified-fixed-precision-noding-plus-polygonization"
          ]
        },
        "coverage": {
          "type": "array",
          "minItems": 1,
          "uniqueItems": true,
          "items": {
            "enum": [
              "already-noded-polygonization",
              "floating-noding-plus-polygonization",
              "certified-fixed-precision-noding-plus-polygonization",
              "component-local-graph",
              "nested-containment",
              "production-scale-network"
            ]
          }
        },
        "minimum_input_segments": {
          "type": "integer",
          "minimum": 1
        },
        "required_work_fields": {
          "type": "array",
          "minItems": 1,
          "uniqueItems": true,
          "items": {"enum": ["component_memory"]}
        }
      }
    }
  }
}
